{
  "schemaVersion": 1,
  "environment": "production",
  "state": "ready",
  "release": {
    "version": "2.0.5",
    "gitTag": "docs-v2.0.5",
    "sourceCommit": "8ed4f43888e152dc02f299368e9d44a040c3f7dd",
    "githubReleaseUrl": "https://github.com/aziontech/docs/releases/tag/docs-v2.0.5"
  },
  "build": {
    "nodeVersion": "26",
    "cliVersion": "4.23.0",
    "configDir": "apps/docs/azion/production"
  },
  "deploy": {
    "trigger": "release",
    "requestedBy": "github-actions[bot]",
    "previousVersion": "2.0.4",
    "reason": null,
    "workflowRunId": null,
    "workflowRunAttempt": null,
    "workflowRunUrl": null,
    "deployedAt": null
  },
  "stage": {
    "deploymentId": 7053523878,
    "gitTag": "docs-v2.0.5",
    "sourceCommit": "8ed4f43888e152dc02f299368e9d44a040c3f7dd",
    "state": "success",
    "logUrl": "https://github.com/aziontech/docs/actions/runs/38489592333",
    "deployedAt": "2026-10-14T00:30:15Z"
  },
  "approval": {
    "mechanism": "GitHub pull request — main ruleset: 1 approval, code owner review, no bypass actors",
    "instructions": "Production deploys run from main when this file changes. Change it through a promotion pull request, never by pushing to main."
  }
}
